{
  "schema_version": "run-artifact.v1",
  "artifact_kind": "warehouse-simulation-run",
  "scenario_id": "sample-small-warehouse",
  "seed": 20240627,
  "started_at_ms": 10,
  "finished_at_ms": 220,
  "final_world_time_ms": 220,
  "kpi_summary": {
    "total_duration_ms": 210,
    "total_completed_work_items": 3,
    "event_log_line_count": 10,
    "receipt_throughput_per_hour": 17142.857,
    "outbound_order_throughput_per_hour": 17142.857,
    "each_pick_order_throughput_per_hour": 17142.857,
    "total_work_item_throughput_per_hour": 51428.571
  },
  "layout": {
    "resources": [
      {
        "resource_id": "dock-1",
        "node_id": "dock-1",
        "x": 0,
        "y": 0
      },
      {
        "resource_id": "forklift-1",
        "node_id": "forklift-1",
        "x": 1,
        "y": 0
      },
      {
        "resource_id": "station-1",
        "node_id": "station-1",
        "x": 2,
        "y": 0
      },
      {
        "resource_id": "worker-1",
        "node_id": "worker-1",
        "x": 3,
        "y": 0
      }
    ]
  },
  "position_timeline": [
    {
      "operation_id": "receipt-1",
      "operation_type": "inbound",
      "stage_type": "dock",
      "resource_id": "dock-1",
      "at_ms": 10,
      "event_type": "start",
      "node_id": "dock-1",
      "x": 0,
      "y": 0
    },
    {
      "operation_id": "order-1",
      "operation_type": "outbound",
      "stage_type": "worker",
      "resource_id": "worker-1",
      "at_ms": 20,
      "event_type": "start",
      "node_id": "worker-1",
      "x": 3,
      "y": 0
    },
    {
      "operation_id": "each-order-1",
      "operation_type": "each_pick",
      "stage_type": "station",
      "resource_id": "station-1",
      "at_ms": 60,
      "event_type": "start",
      "node_id": "station-1",
      "x": 2,
      "y": 0
    },
    {
      "operation_id": "each-order-1",
      "operation_type": "each_pick",
      "stage_type": "worker",
      "resource_id": "worker-1",
      "at_ms": 60,
      "event_type": "start",
      "node_id": "worker-1",
      "x": 3,
      "y": 0
    },
    {
      "operation_id": "each-order-1",
      "operation_type": "each_pick",
      "stage_type": "station",
      "resource_id": "station-1",
      "at_ms": 90,
      "event_type": "finish",
      "node_id": "station-1",
      "x": 2,
      "y": 0
    },
    {
      "operation_id": "each-order-1",
      "operation_type": "each_pick",
      "stage_type": "worker",
      "resource_id": "worker-1",
      "at_ms": 90,
      "event_type": "finish",
      "node_id": "worker-1",
      "x": 3,
      "y": 0
    },
    {
      "operation_id": "receipt-1",
      "operation_type": "inbound",
      "stage_type": "dock",
      "resource_id": "dock-1",
      "at_ms": 110,
      "event_type": "finish",
      "node_id": "dock-1",
      "x": 0,
      "y": 0
    },
    {
      "operation_id": "receipt-1",
      "operation_type": "inbound",
      "stage_type": "forklift",
      "resource_id": "forklift-1",
      "at_ms": 110,
      "event_type": "start",
      "node_id": "forklift-1",
      "x": 1,
      "y": 0
    },
    {
      "operation_id": "order-1",
      "operation_type": "outbound",
      "stage_type": "dock",
      "resource_id": "dock-1",
      "at_ms": 120,
      "event_type": "start",
      "node_id": "dock-1",
      "x": 0,
      "y": 0
    },
    {
      "operation_id": "order-1",
      "operation_type": "outbound",
      "stage_type": "worker",
      "resource_id": "worker-1",
      "at_ms": 120,
      "event_type": "finish",
      "node_id": "worker-1",
      "x": 3,
      "y": 0
    },
    {
      "operation_id": "receipt-1",
      "operation_type": "inbound",
      "stage_type": "forklift",
      "resource_id": "forklift-1",
      "at_ms": 210,
      "event_type": "finish",
      "node_id": "forklift-1",
      "x": 1,
      "y": 0
    },
    {
      "operation_id": "order-1",
      "operation_type": "outbound",
      "stage_type": "dock",
      "resource_id": "dock-1",
      "at_ms": 220,
      "event_type": "finish",
      "node_id": "dock-1",
      "x": 0,
      "y": 0
    }
  ],
  "event_log": [
    "inbound|0|10|inbound.receipt_arrived.receipt-1|InboundReceiptArrived",
    "inbound|1|110|inbound.unload_completed.receipt-1|InboundUnloadCompleted",
    "inbound|2|210|inbound.putaway_completed.receipt-1|InboundPutawayCompleted",
    "outbound|0|20|outbound.order_released.order-1|OutboundOrderReleased",
    "outbound|1|120|outbound.pick_completed.order-1|OutboundPickCompleted",
    "outbound|2|220|outbound.load_completed.order-1|OutboundLoadCompleted",
    "each_pick|0|30|each_pick.order_released.each-order-1|EachPickOrderReleased",
    "each_pick|1|60|each_pick.at_station.each-order-1|EachPickAtStation",
    "each_pick|2|90|each_pick.completed.each-order-1|EachPickCompleted",
    "each_pick|3|130|each_pick.staged.each-order-1|EachPickStaged"
  ]
}
